{
  "vectorId": "VEC_L4_GRANT_REVOKED_BEFORE_PASTE",
  "title": "Level 4 grant revoked between copy and paste",
  "level": 4,
  "category": "rights-aware-enforcement",
  "description": "Grant revoked after copy and before paste must deny on re-evaluation.",
  "requires": [
    "validateEnvelope",
    "evaluatePolicy",
    "processTransferClaim"
  ],
  "tags": [
    "policy",
    "grant-revoked"
  ],
  "status": "active",
  "introducedIn": "0.3.0",
  "updatedIn": "0.3.0",
  "runner": {
    "clock": "2026-03-01T12:00:00Z",
    "operations": [
      "validateEnvelope",
      "evaluatePolicy",
      "processTransferClaim"
    ],
    "inputFiles": {
      "payload": "input/payload.json"
    },
    "expectedFile": "expected/outcome.json"
  }
}
