{
  "vectorId": "VEC_L4_ATTRIBUTION_REQUIRED_ALLOW",
  "title": "Level 4 attribution_required allows with attribution plan",
  "level": 4,
  "category": "rights-aware-enforcement",
  "description": "Attribution required segment is accepted with explicit attribution requirement.",
  "requires": [
    "validateEnvelope",
    "evaluatePolicy",
    "processTransferClaim"
  ],
  "tags": [
    "policy",
    "attribution"
  ],
  "status": "active",
  "introducedIn": "0.3.0",
  "updatedIn": "0.3.0",
  "runner": {
    "clock": "2026-03-01T12:00:00Z",
    "operations": [
      "validateEnvelope",
      "evaluatePolicy",
      "processTransferClaim"
    ],
    "inputFiles": {
      "payload": "input/payload.json"
    },
    "expectedFile": "expected/outcome.json"
  }
}
